A2: MGB History:
A4: This MGB was fully restored in 1997. Most parts have been replaced either during that time or since then, including adding a roll-bar, alpine CD player and amplifier, and changing the dashboard, windshield, paint, apholstery, and important engine components such as the carborator. In 2000 the engine was completely rebuilt, as well as the transmission, clutch, and brakes. Some of the most recent major repairs (for which I have receipts) are listed below.
A6: Recent Major Repairs (with receipts):
A8: Item: | B8: Parts: | C8: Labor: | D8: Total Price: | F8: Date: | H8: Milage:
H9: (as read from meter)
A10: Transmission, Clutch, and Brakes | B10: 461.05 | C10: 1060.5 | D10: =B10+C10 -> 1521.55 | F10: 36707
A11: Engine Major Rebuild | B11: 2083.4 | C11: 840 | D11: =B11+C11 -> 2923.4 | F11: 36791 | H11: 28,262 miles
A12: Alternator | B12: 65.99 | D12: =B12+C12 -> 65.99 | F12: 37592
A13: Water Pump | B13: 89.98 | C13: 75 | D13: =B13+C13 -> 164.98 | F13: 37719
A14: Convertible Top | B14: 199 | D14: =B14+C14 -> 199 | F14: 38231
A15: Tune-up, plugs, cords, etc. | B15: 74.8 | C15: 115.2 | D15: =B15+C15 -> 190 | F15: 38337 | H15: 43,000 miles